317070;317070;2018;6047;31;3;3;6;0;0;0;;;;2046;Francisco Graca de Moura;Avenida Francisco Goncalves Vallin -  540 - Rezende;Rezende;37062-200;Varginha;MG;(35) 36902305;thulyo.paiva@varginha.mg.gov.br;Nao;1;;;;;;;;;;;;;;;;;;;;;;;;;;1;1;$130.250,00;;;1;1;1;1;;1;1;;1;Religiosos.;25;5450;35000;;1;1;;;;;0;1;-21551;-45.43
352500;352500;2018;6047;35;3;3;6;0;0;0;;;;2090;Eusmize Pedro da Costa;Rua Rubens Lopes da Silva, 01;Parque J.M.C;06600-042;Jandira;SP;(11) 47727222;eusmize@hotmail.com;prefeiturajandira@sp.gov.br;1;;;;;;;;;;;;;;;;;;;;;;;;;;2;99;;;;;;1;;1;;1;;1;ONGS;24;5000;13440;;;;;;;;99;99;-2.3528303795738E+16;-4.6899261474609296E+16
351907;351907;2018;6047;35;3;4;6;1;0;0;;;;2087;Banco Municipal de Alimentos de Hortolnandia;Rua Maria Catarina Vasconcellos Pinheiro, nÂº 65, Parque Odimar;Parque Odimar;13186-482;Hortolandia;SP;(19) 384566303;bancoalimentos@hortolandia.sp.gov.br;http://www2.hortolandia.sp.gov.br/;1;;;;;;;;;;;;;;;;;;;;;;;;;;1;1;$450.000,00;;;1;;1;1;;;1;;;;23;3000;40000;;;1;;1;;Oriundos do desperdicio e campanhas de pessoa fisica;0;1;-2.28961577867844E+16;-4719241619108060
291920;291920;2018;6047;29;2;3;6;0;0;0;;;;2005;Banco de Alimentos;Rua Nova Esperanca, s/n;Portao;42700-000;Lauro de Freitas;BA;(71) 333699942;lfdedsan@gmail.com;;1;;;;;;;;;;;;;;;;;;;;;;;;;;1;0;;;;1;;;1;;1;;;;;23;2500;1500;;;;;1;;Empresa de distribuicao de alimentos;0;;-1286755614663610;-3.8299627304077104E+16
353080;353080;2018;6047;35;3;2;5;0;0;0;;;;2149;Banco de Alimentos de Mogi Mirim;Rua Sergipe - 141;Saude;13800-719;Moji Mirim;SP;(19) 38041800;bancodealimentos@mogimirim.sp.gov.br;;1;;;;;;;;;;;;;;;;;;;;;;;;;;1;1;$289.000,00;;;;;;1;;;;;;;23;2150;70;;;1;;1;;Doacoes;0;0;-22432;-46958
312230;312230;2018;6047;31;3;4;6;1;0;0;;;;2029;Banco de Alimentos de Divinopolis;Rua Jose Balbino Pereira, 81 - Bairro Espirito Santo;Espirito Santo;35.500-254;Divinopolis;MG;(37) 32211088;semag@divinopolis.mg.gov.br;www.divinopolis.mg.gov.br;1;;;;1;;;;;;;;;;;;;;;;;;;;;;1;1;$153.000,00;;;;;;1;1;;1;1;;;22;20000;2000;;1;;1;;;;0;1;-2.01360729413885E+16;-448754221200943
317057;317057;2018;6047;31;3;1;2;0;0;0;;;;2126;Banco de Alimentos de Vargem Alegre-MG;Av. Sebastiao Machado dos Reis, NÂº 535;Centro;35199-000;Vargem Alegre;MG;(33) 33241303;vargemalegre.relba@carating.com;;1;;;;;;;;;;;;;;;;;;;;;;;;;;1;99;;;;1;;;;;;;;1;IGREJAS,CRAS;22;2000;1200;;;;;;;;0;1;-19608;-42298
330630;330630;2018;6047;33;3;4;6;1;0;1;03/ago/16;2016;01/ago/16;2071;Banco Municipal de Alimentos de Volta Redonda/Unidade da Secretaria Municipal de Acao Comunitaria;Rua Pitagoras, s/nÂº;Retiro;27281-160;Volta Redonda;RJ;(24) 33399186;gisele.almeida@voltaredonda.rj.gov.br;;1;;;;;;;;;;;;;;;;;;;;;;;;;;1;1;$1.000.000,00;;1;;1;1;1;;1;1;1;1;Entidades Socioassistenciais;22;1200;12000;;;;;1;;Pequenos agricultores e hortifruti;0;0;-2249200940219350;-4410447478294370
211400;211400;2018;2018;21;2;2;5;0;0;0;;;;2350;BANCO DE ALIMENTOS;RUA DUQUE DE CAXIAS;CENTRO;65365-000;Ze Doca;MA;(00) 000000000;semaszd@gmail.com;nao;1;;;;;;;;;;;;;;;;;;;;;;;;;;1;99;;;1;;;;;;1;1;1;;;20;5000;;;;;;;1;;99;99;-3243;-45824
500370;500370;2018;4032;50;5;4;6;1;0;0;;;;2296;Banco Municipal de Alimentos;Rua Jose Luis da Silva 3350 Terra Roxa;Terra Roxa;79840-490;Dourados;MS;(67) 934117299;semafes@dourados.ms.gov.br;;1;;;;;;;;;;;;;;;;;;;;;;;;;;1;0;;;1;;1;1;;1;;;;;;19;183;1000;;;;;1;;Hortas Urbanas;0;1;-22221;-54806
320120;320120;2018;6047;32;3;4;6;1;0;1;17/abr/18;2018;01/abr/18;2021;Banco de Alimentos Cecilio Correa Cardoso;Rua Moises Campos Pancini, s/nÂº;Aeroporto;29314-000;Cachoeiro de Itapemirim;ES;(28) 35219114;banco.subsan@gmail.com;nao possui;1;;;;;;;;;;;;;;;;;;;;;;;;;;1;1;$5.000,00;;;;;1;1;1;1;1;1;;;18;4000;8000;;;;1;1;;Alimentos sem valor comercial mais em condicoes de consumo fornecido pelos produtores rurais do entorno da cidade e parcerias em eventos com a entrada solidaria de 1kg de alimento nao perecivel;0;1;-20849;-41113
330285;330285;2018;6047;33;3;3;6;0;0;0;;;;2054;ADRIANA VALECIO DA SILVA;Avenida Coelho da Rocha, 1426;ROCHA SOBRINHO;26.572 - 481;Mesquita;RJ;(21) 37657187;bancodealimentos@mesquita.rj.gov.br;www.mesquita.rj.gov.br;1;;;;;;;;;;;;;;;;;;;;;;;;;;1;0;;;1;;;1;1;;;1;;;;17;4550;7000;;;;1;;;;0;0;-227815;-434287
320530;320530;2018;6047;32;3;4;6;1;1;1;20/mar/14;2014;01/mar/14;2105;Banco de Alimentos Herbert de Souza;Rua Laurentino Proenca Filho, s/nÂº, Armazem I da CONAB;Jardim da Penha;29.046-020;Vitoria;ES;(27) 32246621;bancodealimentos@correio1.vitoria.es.gov.br;www.vitoria.es.gov.br;1;;;;;1;;Foi utilizado recurso federal quando da criacao (modernizacao);;;;;;;;;;;;;;;;;;;1;1;;;;;1;1;1;;;1;1;1;;17;4000;2054874;;1;;1;1;;Mesa Brasil, parcerias em eventos,;0;0;-20281999;-402976538
350650;350650;2018;6047;35;3;3;6;0;0;1;03/mai/16;2016;01/mai/16;2023;Banco de Alimentos de Birigui;Rua Saudades, nÂº 1250;Centro;16200008;Birigui;SP;(18) 36442729;bancodealimentos@birigui.sp.gov.br;nao tem;1;;;;1;;;;;;;;;;;;;;;;;;;;;;1;1;$54.000,00;;;;;;1;1;1;1;1;;;17;3055;10000;;;;;1;;Agricultores locais e da regiao;0;0;-2.12979601468059E+16;-5034246683120720
355400;355400;2018;6047;35;3;3;6;0;0;0;;;;2082;Banco de Alimentos de Tatui;Rua Ernesto Lalau Amadei, 70;Jardim Nossa Senhora de Fatima;18276-410;Tatui;SP;(15) 32597493;bancodealimentos@tatui.sp.gov.br;nao ha;1;;;;;;;;;;;;;;;;;;;;;;;;;;1;1;$90.000,00;;;;;1;1;;1;1;1;;;16;2647;20000;;;;;1;;doacoes de alimentos atraves dos Agricultores e banco de alimentos regionais;0;0;-2335815888310250;-4.78717285394668E+16
292400;292400;2018;6047;29;2;3;6;0;0;0;;;;2301;Banco de Alimentos de Paulo Afonso;RODOVIA BA 210, NÂ° 1720 BAIRRO CARDEAL BRANDAO VILELA;BAIRRO CARDEAL BRANDAO VILELA;48609-10;Paulo Afonso;BA;(75) 36921700;;;1;;;;;;;;;;;;;;;;;;;;;;;;;;1;1;$2.128.660,00;;;;;1;1;;;1;1;;;15;800;2000;;1;;1;;;;0;1;-9447812999154480;-3822540521621700
431750;431750;2018;6047;43;4;2;5;0;0;0;;;;2058;Banco Municipal de Alimentos Bem Nutrir;Avenida Salgado Filho esquina Venancio Aires, S/N, Centro Norte;Centro Norte;98.803-010;Santo Angelo;RS;(55) 3312-2392;assistenciasocial@santoangelo.rs.gov.br;www.santoangelo.rs.gov.br;1;;;;1;;;;;;;;;;;;;;;;;;;;;;1;99;;;;1;;1;1;;1;1;1;1;Pastoral da crianca, Projeto Curumim;14;2500;8000;;1;;;1;;Doacoes de alimentos;0;0;-28299;-54263
412810;412810;2018;6047;41;4;3;6;0;0;1;21/mar/16;2016;01/mar/16;2067;Banco de Alimentos;Av. Julio Cesar Jarros, 2684;Jd. Alto da Boa Vista;87506-400;Umuarama;PR;(44) 39061036;bancodealimentos@umuarama.pr.gov.br;nao;1;;;;1;;;;;;;;;;;;;;;;;;;;;;1;1;$27.200,00;;1;;1;1;1;1;;1;;;;13;10000;40000;;;;;1;;Conab e doacoes provenientes de campanhas de arrecadacao;1;1;-2378779917261570;-5.3319804668426496E+16
313170;313170;2018;6047;31;3;3;6;0;0;0;;;;2146;Banco de Alimentos de Itabira;Rua Santana, 426;Penha;35900-064;Itabira;MG;(31) 38392261;itabira.relba@gmail.com;Nao possui;1;;;;;;;;;;;;;;;;;;;;;;;;;;1;0;;;;1;;1;1;;1;1;1;;;13;4000;6500;;;;;1;;Doadores espontaneos;1;1;-1.96149897679229E+16;-4322412014007560
354870;354870;2018;6047;35;3;5;7;1;0;1;11/out/17;2017;01/out/17;2080;Banco de Alimentos;Avenida Redencao, 271;Jardim do Mar;09.725-680;Sao Bernardo do Campo;SP;(11) 41263709;bancodealimento@saobernardo.sp.gov.br;;1;;;;;;;;;;;;;;;;;;;;;;;;;;1;1;;;;;1;1;1;;;;;;;13;2155;5890;;1;1;1;1;;hortas comunitarias municipais;0;;-2.36971044878325E+16;-465544106388092
351060;351060;2018;4032;35;3;4;6;1;0;0;;;;2313;Banco de Alimentos;Estrada Ernestina Vieira, 149 - Vila Dirce - Carapicuiba;Vila Dirce;06382-260;Carapicuiba;SP;(11) 41676222;secretaria.trabalho@carapicuiba.sp.gov.br;www.carapicuiba.sp.gov.br;1;;;;;;;;;;;;;;;;;;;;;;;;;;1;0;;;;;;;;;;1;1;;;13;1500;1200;;;;;;;;0;0;-235234673;-468406808
313055;313055;2018;6047;31;3;1;2;0;0;0;;;;2297;Banco de Alimentos de Imbe de Minas;Praca Sao Joao, NÂº 111;Centro;35323-000;Imbe de Minas;MG;(33) 33251465;imbedeminas.relba@gmail.com;;1;;;;;;;;;;;;;;;;;;;;;;;;;;1;1;;;1;;;;;;1;;;;;12;1215;7914;;;;;1;;Doacao do produtor;0;1;-1.95948973116726E+16;-4.1967580318450896E+16
352500;352500;2018;6047;35;3;3;6;0;0;0;;;;2329;BANCO DE ALIMENTOS;Rua Rubens Lopes da Silva, 01;PARQUE J.MC;06600-042;Jandira;SP;(11) 47076026;acaosocial@jandira.gov.br;prefeitura do municipio de jandira;1;;;;1;;;;;;;;;;;;;;;;;;;;;;1;99;;;;;;1;1;1;;1;;;;10;1000;900;;;;;;;;99;99;-23528;-46903
270760;270760;2018;2018;27;2;1;3;0;0;0;;;;2347;Aliment Aqui - Programa de Aquisicao de Alimentos - PAA;Rua 13 de Junho s/n;Centro;57750-000;Quebrangulo;AL;(82) 999328031;sec.agricultura.quebrangulo@gmail.com;;1;;;;;;;;;;;;;;;;;;;;;;;;;;1;0;;;1;1;;;;;1;1;;;;10;350;1500;;;;;;;;0;1;-9321753450568560;-3.64746522903442E+16
430920;430920;2018;2018;43;4;4;6;1;0;0;;;;2346;Banco de Alimentos MUnicipal;Av. Centenario, 87;passo das Pedras;94195-410;Gravatai;RS;(51) 36007756;smfcas.segurancaalimentar@gravatai.rs.gov.br;;1;;;;;;;;;;;;;;;;;;;;;;;;;;1;99;;;;;1;;1;1;;1;1;;;10;300;;;1;;;1;;Acoes de entidades;0;1;-2.99499147659797E+16;-5099501609802240
432260;432260;2018;2018;43;4;2;5;0;0;0;;;;2325;Banco de Alimentos de Venancio Aires;Acesso Imperatriz Dona Leopoldina, 3887;Leopoldina;95800-000;Venancio Aires;RS;(51) 999950825;bancoalimentosvenancioaires@gmail.com;nao possui;1;;;;;;;proprios;;;;;;;;;;;;;;;;;;;3;0;;;1;;;;;1;1;1;1;;;10;200;1000;;1;;;1;;pessoas fisicas;0;0;-296403587;-52198052
315935;315935;2018;6047;31;3;1;2;0;0;0;;;;2286;Banco de Alimentos de Santa Rita de Minas-MG;Rua Alvaro Correa de Faria, 82;Centro;35326-000;Santa Rita de Minas;MG;(33) 33266000;santaritademinas.relba@gmail.com;Nao Possui site;1;;;;;;;;;;;;;;;;;;;;;;;;;;1;1;$30.000,00;;1;;;;1;;1;;;;;8;2500;45000;;1;;1;1;;Doacoes de outros Bancos de Alimentos e tambem de agricultores familiares parceiros;0;1;-1987479202615940;-4213345885276790
312770;312770;2018;4033;31;3;4;6;1;0;0;;;;2287;Banco de Alimentos de Governador Valadares;Avenida Luiz Goncalves Lessa nÂº 12;Sao Raimundo;35041-380;Governador Valadares;MG;(33) 32750492;governadorvaladares.relba@gmail.com;;1;;;;;1;;O banco funciona no predio sa CECAF que foi construido com recursos do municipio e MDA.;;;;;;;;;;;;;;;;;;;1;1;$1.545.000,00;;;;;1;1;1;1;1;1;1;Associacao de catadores de materiais reciclaveis.;8;300;1230;;;;;;;Sobras do PNAE (doacao de agricultores) e campanhas de arrecadacao de alimentos nao pereciveis.;0;0;-1.88951414100867E+16;-4.1951594352722096E+16
250860;250860;2018;4033;25;2;1;3;0;0;0;;;;2243;BANCO MUNICIPAL DE ALIMENTOS DA CIDADE DE LUCENA;RUA JOSE BEZERRA CAVALCANTE;CENTRO;58315-000;Lucena;PB;(83) 986200788;ed.jame123@hotmail.com;NAO CONSTA;1;;;;;;;;;;;;;;;;;;;;;;;;;;99;99;;;;;;;;;;1;;;;8;;;;;;;;;;99;99;-690628915;-34921340160614
240810;240810;2018;4032;24;2;5;7;1;1;0;;;;2338;Banco de Alimentos de Natal;Rua da Concordia, 1874;Quintas;59035-240;Natal;RN;(84) 32329292;elisangela.teixeira@natal.rn.gov.br;Nao possui;1;;;;1;;;;;;;;;;;;;;;;;;;;;;1;1;;;;;;;;;;1;1;;;7;136;185;;;;;;;Feiras da Agricultura Familiar;0;0;-580330814572833;-3.52298079728097E+16
317005;317005;2018;4033;31;3;1;3;0;0;0;;;;2312;Banco de Alimentos de Ubaporanga;Cel Antonio Rezende sn;Centro;35338-000;Ubaporanga;MG;(33) 33231200;ubaporanga2.relba@gmail.com;;1;;;;;;;;;;;;;;;;;;;;;;;;;;1;0;;;;;1;1;1;1;1;1;1;;;6;1500;20000;;;1;;;;;0;1;-1962983514601260;-4210954427719110
315725;315725;2018;4032;31;3;1;2;0;0;0;;;;2358;Banco de Alimentos de Santa Barbara do Leste;Rua Monsenhor Rocha 110;centro;35328-000;Santa Barbara do Leste;MG;(33) 33261569;recepcaosbl2017@gmail.com;nao tem;1;;;;;;;;;;;;;;;;;;;;;;;;;;98;99;;;1;;;;;;;;;;;6;600;5000;;;;;;;;0;1;-1.99749823068903E+16;-4214210629463190
314700;314700;2018;4033;31;3;2;5;0;0;0;;;;2343;banco de alimentos de paracatu- MG;rua: praca Euzebio s/n;centro;38600-000;Paracatu;MG;(38) 36716211;acaosocial@paracatu.mg.gov.br;;1;;;;;;;;;;;;;;;;;;;;;;;;;;1;1;$88.400,00;;;;;;;;;;;;;6;240;1500;;;;;1;;doacoes;0;0;-1.72238871540617E+16;-4687796473503110
311940;311940;2018;2018;31;3;3;6;0;0;0;;;;2295;Banco de Alimenos de Coronel Fabriciano;rua acai 250;floresta;35170-220;Coronel Fabriciano;MG;(31) 38467738;bancoalimentosfabri@gmail.com;nao possui;1;;;;;;;;;;;;;;;;;;;;;;;;;;1;0;;;1;;;1;;1;1;;;1;entidades cadastradas no cmdca e cmi;6;200;1000;;;;;;;;0;0;-19519;-42629
312385;312385;2018;6047;31;3;1;2;0;0;0;;;;2124;Banco de Alimentos de Entre Folhas;Rua Daniel Gomes;Centro;35324-000;Entre Folhas;MG;(33) 33246112;samaentrefolhas@gmail.com;;1;;1;;1;;;;;;;;;;;;;;;;;;;;;;1;0;;;1;;;;1;;;1;;1;0;5;2000;7500;;;;;;;;99;1;-1.96268035260518E+16;-4223093032836910
312930;312930;2018;2018;31;3;1;3;0;0;0;;;;2331;BANCO DE ALIMENTOS DE IAPU;Rua Jair Fernandes de Melo, 353;CENTRO;35190-000;Iapu;MG;(33) 33551105;saneamento@iapu.mg.gov.br;nao tem;1;;;;;1;;ALUGADO;;;;;;;;;;;;;;;;;;;99;99;;;;;;;;;;;;;;5;1000;5000;;;;;1;;DOACAO DE PRODUTORES;0;1;-1.94374366470925E+16;-4.22172564268112E+16
312930;312930;2018;2018;31;3;1;3;0;0;0;;;;2332;BANCO DE ALIMENTOS DE IAPU;RUA JAIR FERNANDES DE MELO, 353;CENTRO;35190-000;Iapu;MG;(33) 33551105;saneamento@iapu.mg.gov.br;NAO TEM;1;;;;;1;;ALUGADO;;;;;;;;;;;;;;;;;;;99;99;;;;;;;;;;;;;;5;1000;5000;;;;;1;;DOACAO DE PRODUTORES;0;1;-194374821751639;-4.22172564268112E+16
521590;521590;2018;2018;52;5;1;1;0;0;0;;;;2336;Secretaria Municipal de Assistencia Social;Rua Pedro Geraldo Lopes 395;Centro;75990-000;Palminopolis;GO;(64) 36751379;assistencia.social@outlook.com;Nao;1;;;;;;;;;;;;;;;;;;;;;;;;;;1;99;;;1;1;;1;;;1;;;;;5;550;2750;;;;;;;Lavoura comunitaria, fazendinha municipal;1;0;-1.67965503205395E+16;-5.0164904594421296E+16
316760;316760;2018;2018;31;3;1;3;0;0;0;;;;2321;Banco de Alimentos de Simonesia;Rua Jose Batista de Oliveira nÂº 47;Bom Sucesso;36930-000;Simonesia;MG;(33) 33361235;simonesia.relba@gmail.com;;1;;;;;;;Aluguel do espaco;;;;;;;;;;;;;;;;;;;98;0;;;1;;;1;;;;;1;;;5;307;1500;;;;;;;;0;1;-201233838;-420024294
312000;312000;2018;2018;31;3;1;1;0;0;0;;;;2342;Banco de Alimento de Corrego Novo - MG;Praca Vicente Domingos de Paula;Sao Geraldo Mangela;35345-000;Corrego Novo;MG;(33) 33531184;corregonovo.relba@gmail.com;;1;;;;;;;;;;;;;;;;;;;;;;;;;;99;99;;;1;1;1;1;;;;1;1;1;Escolas, creche, comunidades.;5;250;;;;;;;;;99;99;-1.9833428531278E+16;-4.24066150188446E+16
316447;316447;2018;4033;31;3;1;2;0;0;0;;;;2289;Banco de Alimentos de Sao Sebastiao do Anta;RUA FRANCISCO DE ASSIS PEREIRA, 67;CENTRO;35334-000;Sao Sebastiao do Anta;MG;(33) 33157000;saosebastiaodoanta.relba@gmail.com;;1;;;;;;;;;;;;;;;;;;;;;;;;;;1;1;$60.000,00;;1;;;;;;;;1;;;4;2040;18000;;;;;1;;doacoes de produtores;0;1;-1.9498129392703E+16;-4198472499847410
230190;230190;2018;6047;23;2;2;5;0;0;0;;;;2135;Banco de alimentos;Av. Jullis Rimet;Cirolandia;63180-000;Barbalha;CE;(88) 35321189;annictf@ig.com.br;nao tem;1;;;;;;;;;;;;;;;;;;;;;;;;;;1;99;;;1;;;1;;1;;;;;;4;800;;;;;1;;;;1;1;-7326202969311190;-3929753780364990
315895;315895;2018;4033;31;3;1;4;0;0;0;;;;2251;Banco de Alimentos de Santana do Paraiso;Estrada do Horto 7 a;Horto Paraiso;35169-000;Santana do Paraiso;MG;(31) 32515482;segurancaalimentaras@santanadoparaiso.mg.gov.br;www.santanadoparaiso@.mg.gov.br;1;;;;;;;;;;;;;;;;;;;;;;;;;;1;0;;;1;;;;1;1;;;;;;4;70;250;;;;1;;;;1;1;-1.93677131520823E+16;-4.25317239761352E+16
311840;311840;2018;2018;31;3;1;4;0;0;0;;;;2290;banco de alimentos de conselheiro pena;rodovia do cafe, saida para alto sao jose, sn;operarios;35240-000;Conselheiro Pena;MG;(33) 32613500;conselheiropena.relba@gmail.com;n tem;1;;;;;;;;;;;;;;;;;;;;;;;;;;1;99;;;;;;1;1;;;;1;;;4;60;2000;;;1;;;;;1;99;-1.917220731053E+16;-4.1471908092498704E+16
316420;316420;2018;4033;31;3;1;3;0;0;0;;;;2229;Banco de Alimentos do Municipio de Sao Romao;Rua dos Oliveiras n 750;Centro;39290-000;Sao Romao;MG;(38) 992901429;bancodealimentos@gmail.com;--;1;;;;;;;;;;;;;;;;;;;;;;;;;;1;99;;;1;;;1;;;;;;;;3;2136;12500;;;;;;;MESA BRASIL SESC, CONAB;1;;-1.63693918689158E+16;-450706171989441
130083;130083;2018;2018;13;1;1;3;0;0;0;;;;2308;CRAS - Luiza Marques Costa;Rua: Getulio Vargas, 274;Centro;69425-000;Caapiranga;AM;(92) 992644209;afonsomartins2@hotmail.com;;1;;1;;;;;;;;;;;;;;;;;;;;;;;;1;1;$333.800,00;;;1;;;;;1;;;;;3;200;500;;;;;;;;0;1;-3328394673906390;-6121246647860970
210905;210905;2018;6047;21;2;1;2;0;0;0;;;;2328;CENTRAL DE RECEBIMENTO DE ALIMENTOS PAA E PNAE;RUA CAPITAO PASSINHO SNÂº;CENTRO;65263-000;Porto Rico do Maranhao;MA;(98) 984333733;;;1;;;;;;;;;;;;;;;;;;;;;;;;;;98;99;;;1;;;;;;;;;;;2;1770;2200;;;;;;;;1;1;-18597328;-445854991
313115;313115;2018;2018;31;3;1;3;0;0;0;;;;2304;banco municipal de alimentos;rua joao damasceno, nÂº20;centro;35198-000;Ipaba;MG;(31) 33201281;ipaba.relba@gmail.com;nao possui;1;;;;;;;;;;;;;;;;;;;;;;;;;;1;0;;;1;;;;1;;;;;;;2;1500;12000;;;;;1;;doacoes de presidio denio moreira de carvalho e agricultura familiar local\ projeto santa marta;0;1;-1.94129710509413E+16;-4.2418019771575904E+16
312370;312370;2018;4033;31;3;1;3;0;0;0;;;;2319;Banco d Alimentos de Engenheiro Caldas.;ANTIGO POSTO DE SAUDE/ VILA MARTINS;VILA MARTINS;35130-000;Engenheiro Caldas;MG;(33) 32341185;governo@engenheirocaldas.mg.gov.br;WWW.ENGENHEIROCALDAS.MG.GOV.BR;1;;;;;;;;;;;;;;;;;;;;;;;;;;1;1;$50.000,00;;;;;;;;;;;;;2;50;100;;;;;;;;0;1;-1.92304459144146E+16;-4205600738525390
314545;314545;2018;2018;31;3;1;2;0;0;0;;;;2356;Banco de Alimento;Rua Diamantina.;centro;39398-000;Olhos-d`Agua;MG;(38) 32517272;secassistenciasocial_olhos@yahoo.com;nao tem;1;;;;;;;;;;;;;;;;;;;;;;;;;;1;99;;;1;;;;;;;;1;;;1;1400;1000;;;;;;;;1;1;-1739855834256400;-4356838703155510
314545;314545;2018;2018;31;3;1;2;0;0;0;;;;2355;Banco de alimento;Rua Diamantina;Centro;39398-000;Olhos-d`Agua;MG;(38) 32517272;secassistenciasocial_olhos@yahoo.com.br;nao tem .;1;;;;;;;;;;;;;;;;;;;;;;;;;;1;0;;;1;;;;;;;;1;;;1;1200;500;;;;;;;;1;1;-1.73982921551822E+16;-4356873035430900
250910;250910;2018;4033;25;2;1;4;0;0;0;;;;2337;Banco de Alimentos;Rua: 15 de janeiro, 173;Centro;58345-000;Mari;PB;(83) 996614319;sec.desenvolvimentohumano.mari@gmail.com;www.mari.pb.gov.br;1;;;;;;;;;;;;;;;;;;;;;;;;;;99;99;;;;;;;;;;;;;;1;500;30000;;;;;;;;0;1;-7060881211691520;-3.53153371810913E+16
431720;431720;2018;4032;43;4;2;5;0;0;0;;;;2326;banco de alimentos;rua castelo branco 886;centro;98780-200;Santa Rosa;RS;(55) 35115125;ucam@santarosa.rs.gov.br;;1;;;;;;;;;;;;;;;;;;;;;;;;;;99;99;;;;;;;1;;;;;;;1;80;200;;;;;;;doacao da comunidade;0;0;-2.78765437031973E+16;-5446957111358640
353020;353020;2018;6047;35;3;1;3;0;0;0;;;;2138;Programa de Aquisicao de Alimentos;Rua: Dr. Noboru Kasae, s/n;centro;19260-000;Mirante do Paranapanema;SP;(18) 39912496;mirante_paa@hotmail.com;https://www.facebook.com/programadealimentosmirante?fref=ts;1;;;;;;;;;;;;;;;;;;;;;;;;;;1;99;;;1;;;;;;;1;;;;;2600;87500;;;;;;;;99;;-2.22990232641173E+16;-5.19104433059692E+16
351535;351535;2018;2018;35;3;1;2;0;0;0;;;;2323;BANCO DE ALIMENTOS;RUA ADRIANE CRISTINA VENANCIO DA SILVA;CENTRO;19275-000;Euclides da Cunha Paulista;SP;(18) 32831351;associal123@hotmail.com;nao tem;1;;;;;;;;;;;;;;;;;;;;;;;;;;1;99;;;;;;;;;;;;;;;1031;13600;;;;;;;;0;1;-2255572362196170;-5.2587718964496096E+16
261450;261450;2018;2018;26;2;2;5;0;0;0;;;;2353;Banco Publico de Alimentos de Surubim;Rua Largo da Cabaceira, nÂº 120. Cabaceira, Surubim/PE. CEP: 55.750-000;Centro;55750-000;Surubim;PE;(81) 36341460;sasdh.surubim@gmail.com;Nao possui;1;;;;;;;;;;;;;;;;;;;;;;;;;;1;99;;;;;;;;;;;;;;;200;1000;;;;;;;;0;0;-7832;-35756
290240;290240;2018;6047;29;2;1;3;0;0;0;;;;2288;BANCO DE ALIMENTOS DA SECRETARIA MUNICIPAL DE ASSISTENCIA SOCIAL;RUA PRESIDENTE MEDICI S/N;CENTRO;45675-000;Aurelino Leal;BA;(73) 35541610;smas.aurelinoleal@gmail.com;nao possue;1;;;;;;;;;;;;;;;;;;;;;;;;;;1;0;;;;1;;;;;;;;;;;150;3000;;;;;;;;99;1;-14317;-39327
251140;251140;2018;6047;25;2;1;3;0;0;0;;;;2310;BANDO DE ALIMENTOS DE PICUI - BAP;RUA TERTULIANO HENRIQUES;CENECISTA;58187-000;Picui;PB;(83) 33712393;;;1;;;;;1;;NAO HOUVE UMA CONSTRUCAO, O BANCO DE ALIMENTOS FUNCIONA EM UM PREDIO CEDIDO PELA PREFEITURA.;;;;;;;;;;;;;;;;;;;1;0;;;;;;;;;;;;;;;20;240;;;;;;;ARRECADACAO DE ALIMENTOS EM EVENTOS PUBLICOS;0;0;-6510599508324520;-3636116266250610
291840;291840;2018;6047;29;2;4;6;1;0;1;11/out/17;2017;01/out/17;2010;Banco Municipal de Alimentos;Distrito Industrial de Juazeiro Quadra 03;Distrito Industrial;48900-000;Juazeiro;BA;(74) 999888215;mariojaguarari@hotmail.com;www.prefeituramunicipaljuazeiro.ba.gov.br;3;;;;;;;;;;;;;;;;;;;;;;;;;;;;;;;;;;;;;;;;;;;;;;;;;;;;;-9414;-40503
230640;230640;2018;6047;23;2;3;6;0;0;1;27/nov/14;2014;01/nov/14;2016;Banco de Alimentos de Itapipoca;Rua Pedro I, S/N;Boa Vista;62.500 - 000;Itapipoca;CE;(88) 36315950;;nao tem;3;;;;;;;;;;;;;;;;;;;;;1;;;;;;;;;;;;;;;;;;;;;;;;;;;;;;;;-3.50301215953169E+16;-3.9581573009490896E+16
230550;230550;2018;6047;23;2;3;6;0;0;1;27/nov/14;2014;01/nov/14;2017;Banco de Alimentos;Rua Jose Caeiras de Souza;Areias;63.500-000;Iguatu;CE;(88) 9268 -3921 - 9948-0900;saspmiguatu@yahoo.com.br;;2;;;;;;;;;;;;;;;;;;;;;;;;;;;;;;;;;;;;;;;;;;;;;;;;;;;;;-6359;-39299
320130;320130;2018;6047;32;3;4;6;1;0;0;;;;2022;Banco de Alimentos Josue de Castro;Rua: Walfredo Ferreira Paiva;Rosa da Penha;29143-291;Cariacica;ES;(27) 33466337;segurancaalimentar@cariacica.es.gov.br;www.cariacica.es.gov.br;1;;;;;;;;;;;;;;;;;;;;;;;;;;1;1;;;;;;;1;;;;;;;;;2500;;;;;1;;Doacoes;0;1;-203505091;-403781757
521190;521190;2018;6047;52;5;2;5;0;0;0;;;;2032;Banco de Alimentos;Rua Leomar Ferreira de Melo c/ Rua 01 QD 01 Conjunto Residencial Cidade Jardim;Conjunto Residencial Cidade Jardim;75807-647;Jatai;GO;(64) 36328837;projetos@jatai.go.gov.br;www.jatai.go.gov.br;3;;;;;;;;;;;;;;;;;;;;;;;1;;Processo Licitatorio para construcao;;;;;;;;;;;;;;;;;;;;;;;;;;;;-1.78748569414319E+16;-5169453620910640
421010;421010;2018;6047;42;4;2;5;0;0;0;;;;2078;BANCO DE ALIMENTOS DE MAFRA;Rua Benemerito     Pedro Kuss, s/nÂº - Centro, CEP: 89300000;Centro;89.300 - 000;Mafra;SC;(47) 3643-7181;shturnes@hotmail.com;nao tem;3;;;;;;;;;;;;;;;;;;;;;1;;1;;O encerramento do PAA CDDS paralizou as atividades do BA. Sma-se a este fato, a falta de pessoal para operacionalizar devido a impossibilidade de contratacao de efetivos ou comissionados.;;;;;;;;;;;;;;;;;;;;;;;;;;;;-2610685735636230;-4980643766403190
350550;350550;2018;6047;35;3;3;6;0;0;0;;;;2079;Banco de Alimentos;Rua Tomas de Paula Oliveira, nÂº 490;Licia;14781-439;Barretos;SP;(17) 33244555;bancodealimentos@barretos.sp.gov.br;Nao possui;3;;;;;;;;;;;;;;;;;;;;;;;;;;;;;;;;;;;;;;;;;;;;;;;;;;;;;-2.05482786467861E+16;-4855976343154900
311340;311340;2018;6047;31;3;2;5;0;0;1;10/fev/17;2017;01/fev/17;2110;Banco de Alimentos de Caratinga;BR 116, KM 529, S/N;Das Gracas;35300000;Caratinga;MG;(33) 33298052;agricultura@caratinga.mg.gov.br;www.caratinga.mg.gov.br;2;;;;;;;;;;;1;;;;;;;;;;;;;;;;;;;;;;;;;;;;;;;;;;;;;;;;;;-197585199940922;-4213333010673520
260790;260790;2018;6047;26;2;5;7;1;0;1;20/nov/13;2013;01/nov/13;2125;ATITUDE QUE ALIMENTA;RUA MARIA HELENA - S/NÂº;CAJUEIRO SECO;54330-610;Jaboatao dos Guararapes;PE;(81) 92667357;sanjgequipe@gmail.com;;3;;;;;;;;;;;;;;;;;;;;;;;1;;O predio e do Governo do estado e estamos aguardando a liberacao para proceder reforma.;;;;;;;;;;;;;;;;;;;;;;;;;;;;-8113;-35015
521190;521190;2018;6047;52;5;2;5;0;0;0;;;;2147;Banco de Alimentos;Rua Leomar Ferreira de Melo c/ Rua 01 Qd. 01;Conjunto Residencial Cidade Jardim;75807-647;Jatai;GO;(64) 36324025;paamunicipal@jatai.go.gov.br;www.jatai.go.gov.br;3;;;;;;;;;;;;;;;;;;;;;;;;;Analise para atendimento de pendencias na GIDUR/ CAIXA ECONOMICA FEDERAL GOIANIA;;;;;;;;;;;;;;;;;;;;;;;;;;;;-1.78748569414319E+16;-5169460058212280
251530;251530;2018;6047;25;2;2;5;0;0;0;;;;2179;Banco de Alimento Municipal;Rua : Adelaide  Chaves;Centro;58337-000;Sape;PB;(83) 981230680;;;2;;;;;;;;;;;;;;;;;;;;;;;;;;;;;;;;;;;;;;;;;;;;;;;;;;;;;-7095;-35233
352310;352310;2018;6047;35;3;4;6;1;0;0;;;;2209;Banco de Alimentos de Itaquaquecetuba;Rua Cabralia Paulista, S/N;Estacao;08571-020;Itaquaquecetuba;SP;(11) 46422121;alimentar@itaquaquecetuba.sp.gov.br;;3;;;;;;;;;;;;;;;;;;;;;1;;;;;;;;;;;;;;;;;;;;;;;;;;;;;;;;-2347923817295310;-4634502053260800
354760;354760;2018;4033;35;3;1;4;0;0;0;;;;2211;SETOR DE ALIMENTACAO E NUTRICAO ESCOLAR / BANCO DE ALIMENTOS;AVENIDA SAO PAULO,NUMERO 1157;VILA RANZANI;14270-000;Santa Rosa de Viterbo;SP;(16) 3954850;sne@santarosa.sp.gov.br;;3;;;;;;;;;;;;;;;;;;;;;;;;;;;;;;;;;;;;;;;;;;;;;;;;;;;;;-2.14881275524446E+16;-4736531996615660
316410;316410;2018;6047;31;3;1;2;0;0;0;;;;2213;PAA;ZINHA MADEIRA;centro;39784-000;Sao Pedro do Suacui;MG;333434113;;;3;;;;;;;;;;;;;;;;;;;;;;;;;;;;;;;;;;;;;;;;;;;;;;;;;;;;;-18366;-42603
290320;290320;2018;4033;29;2;3;6;0;0;0;;;;2220;Nao se aplica;Nao se aplica;Nao se aplica;00000-000;Barreiras;BA;(77) 36139575;chefiadegabinete@barreiras.ba.gov.br;Nao se aplica;3;;;;;;;;;;;;;;;;;;;;;;;1;;diversos;;;;;;;;;;;;;;;;;;;;;;;;;;;;-121312064;-450015337
520620;520620;2018;4033;52;5;2;5;0;0;0;;;;2223;Banco de Alimentos;Rua Carajas, nÂº 3743;Centro;73850-000;Cristalina;GO;(61) 36127367;alimentacao-escolar@hotmail.com;nao tem;3;;;;;;;;;;;;;;;;;;;;;;;;;Falta de recursos do governo Federal;;;;;;;;;;;;;;;;;;;;;;;;;;;;-1.67716720611617E+16;-476149606704712
520620;520620;2018;4033;52;5;2;5;0;0;0;;;;2224;Banco de Alimentos de Cristalina;Rua Carajas nÂº 3743;Centro;73850-000;Cristalina;GO;(61) 36127367;alimentacao-escolar@hotmail.com;sem;3;;;;;;;;;;;;;;;;;;;;;;;;;Falta de recursos do Governo Federal;;;;;;;;;;;;;;;;;;;;;;;;;;;;-1677220622811610;-4761451005935660
411155;411155;2018;4033;41;4;1;2;0;0;1;26/jul/18;2018;01/jul/18;2236;Padaria Municipal e restaurante comunitario de Ivate;Rua Loanda;centro;87525-000;Ivate;PR;(44) 36738000;;;3;;;;;;;;;;;;;;;;;;;;;;;;;;;;;;;;;;;;;;;;;;;;;;;;;;;;;-23409;-53369
410690;410690;2018;6047;41;4;5;7;1;1;1;21/mar/16;2016;01/mar/16;2254;Banco de Alimentos do CEASA PR;BR 116, Km 111, nÂº 22881;Tatuquara;80030-000;Curitiba;PR;(41) 32533232;;;1;;;;;;;;;;;;;;;;;;;;;;;;;;1;0;;;;;;;;;;;;;;;;;;;;;;;;99;;-255529053;-493015075
130063;130063;2018;4033;13;1;1;3;0;0;0;;;;2260;SEMAS/BERURI;Rua Vicente Gomes , 72 - Sao Francisco;Centro;69430-000;Beruri;AM;(97) 33511030;semasberuri@gmail.com;Nao tem;3;;;;;;;;;;;;;;;;;;;;;;;;;;;;;;;;;;;;;;;;;;;;;;;;;;;;;-389474032364144;-6137374877929680
